{
  "schema_version": "1.0.0",
  "module_code": "no_show_recovery",
  "name": "No-Show Recovery",
  "description_short": "When a customer no-shows, automatically reach out and offer an easy rebook window.",
  "outcome": "Turn missed appointments into rebooks instead of dropped customers.",
  "category": "scheduling",
  "price_monthly": 19,
  "tier_availability": [
    "professional",
    "enterprise"
  ],
  "capabilities_required": [
    "calendar",
    "crm",
    "sms",
    "email"
  ],
  "prerequisite_modules": [],
  "compliance_flags": [
    "sms_opt_out",
    "quiet_hours"
  ],
  "activation_type": "instant",
  "trigger": {
    "event": "appointment.no_show"
  },
  "inputs": [
    "appointment_record",
    "contact_record"
  ],
  "actions": [
    "send_sms",
    "send_email",
    "offer_rebook_link",
    "create_task"
  ],
  "configurable_settings": [
    {
      "key": "initial_delay_minutes",
      "label": "First outreach delay (minutes)",
      "type": "int",
      "default": 30
    },
    {
      "key": "follow_up_days",
      "label": "Follow-up attempts (days after)",
      "type": "string",
      "default": "1,3,7"
    },
    {
      "key": "include_incentive",
      "label": "Include small incentive",
      "type": "bool",
      "default": false
    }
  ],
  "templates_used": [
    "tmpl_no_show_first",
    "tmpl_no_show_followup"
  ],
  "recommended_for_personas": [
    "office-manager",
    "scheduler"
  ],
  "recommended_for_blueprints": [
    "med-spa",
    "cleaning",
    "auto-detail"
  ],
  "upsell_from": [
    "appointment_reminder"
  ],
  "upsell_to": [
    "dormant_customer_reactivation"
  ],
  "kpis": [
    "no_show_rebook_rate",
    "no_show_followup_ctr"
  ],
  "downgrade_behavior": {
    "on_cancel": "disable_new_runs_keep_data",
    "data_retention_days": 365
  },
  "source_refs": [
    "5.03",
    "9.XX"
  ],
  "status": "spec"
}
